"CEFR_level","Word_Phrase_Sentence","topic","grammar_type","english","french","example"
"A2","W","Connectors","connector","first","d'abord","D'abord, je prends un café."
"A2","W","Connectors","connector","then","ensuite","Ensuite, je vais au travail."
"A2","P","People & Family","phrase","I was born in","je suis né à","Je suis né à Marseille."
"A2","P","People & Family","phrase","I was born in, feminine","je suis née à","Je suis née à Nice."
"A2","P","People & Family","phrase","I live with","j'habite avec","J'habite avec ma famille."
"A2","P","People & Family","phrase","my address is","mon adresse est","Mon adresse est simple."
"A2","P","People & Family","phrase","can you give me your address, informal","tu peux me donner ton adresse","Tu peux me donner ton adresse ?"
"A2","P","People & Family","phrase","can you give me your address, formal","vous pouvez me donner votre adresse","Vous pouvez me donner votre adresse ?"
"A2","P","Daily Verbs","phrase","I have just","je viens de","Je viens de rentrer."
"A2","P","Daily Verbs","phrase","I am trying to","j'essaie de","J'essaie de comprendre."
"A2","P","Daily Verbs","phrase","I forgot to","j'ai oublié de","J'ai oublié de répondre."
"A2","P","Daily Verbs","phrase","I remembered to","j'ai pensé à","J'ai pensé à appeler."
"A2","P","Daily Verbs","phrase","I decided to","j'ai décidé de","J'ai décidé de partir."
"A2","P","Daily Verbs","phrase","I continue to","je continue à","Je continue à apprendre."
"A2","P","Daily Verbs","phrase","can you help me, informal","tu peux m'aider","Tu peux m'aider ?"
"A2","P","Daily Verbs","phrase","can you help me, formal","vous pouvez m'aider","Vous pouvez m'aider ?"
"A2","P","Daily Verbs","phrase","I would like you to, formal","je voudrais que vous","Je voudrais que vous veniez."
"A2","P","Daily Verbs","phrase","I would like you to, informal","je voudrais que tu","Je voudrais que tu viennes."
"A2","P","Food & Drink","phrase","I have reserved a table","j'ai réservé une table","J'ai réservé une table."
"A2","P","Food & Drink","phrase","we have reserved a table","nous avons réservé une table","Nous avons réservé une table."
"A2","P","Food & Drink","phrase","I would like the menu","je voudrais le menu","Je voudrais le menu."
"A2","P","Food & Drink","phrase","what do you recommend, formal","qu'est-ce que vous recommandez","Qu'est-ce que vous recommandez ?"
"A2","P","Food & Drink","phrase","I am allergic to","je suis allergique à","Je suis allergique aux noix."
"A2","P","Food & Drink","phrase","without salt","sans sel","Sans sel, s'il vous plaît."
"A2","P","Food & Drink","phrase","without sugar","sans sucre","Sans sucre, s'il vous plaît."
"A2","P","Food & Drink","phrase","it was delicious","c'était délicieux","C'était délicieux."
"A2","P","Home","phrase","I am moving house","je déménage","Je déménage samedi."
"A2","P","Home","phrase","I am looking for an apartment","je cherche un appartement","Je cherche un appartement."
"A2","P","Home","phrase","the rent is too high","le loyer est trop élevé","Le loyer est trop élevé."
"A2","P","Home","phrase","there is an elevator","il y a un ascenseur","Il y a un ascenseur."
"A2","P","Home","phrase","there is no elevator","il n'y a pas d'ascenseur","Il n'y a pas d'ascenseur."
"A2","P","Home","phrase","I live on the first floor","j'habite au premier étage","J'habite au premier étage."
"A2","P","Travel & City","phrase","I have a reservation","j'ai une réservation","J'ai une réservation."
"A2","P","Travel & City","phrase","I would like to reserve","je voudrais réserver","Je voudrais réserver."
"A2","P","Travel & City","phrase","the train is late","le train a du retard","Le train a du retard."
"A2","P","Travel & City","phrase","what platform, formal","quel quai","Quel quai, s'il vous plaît ?"
"A2","P","Travel & City","phrase","how long does it take","ça dure combien de temps","Ça dure combien de temps ?"
"A2","P","Travel & City","phrase","I am lost","je suis perdu","Je suis perdu."
"A2","P","Travel & City","phrase","I am lost, feminine","je suis perdue","Je suis perdue."
"A2","P","Travel & City","phrase","turn right, formal","tournez à droite","Tournez à droite."
"A2","P","Travel & City","phrase","turn left, formal","tournez à gauche","Tournez à gauche."
"A2","P","Travel & City","phrase","go straight, formal","allez tout droit","Allez tout droit."
"A2","P","Shopping & Money","phrase","do you have this in another size, formal","vous avez ça dans une autre taille","Vous avez ça dans une autre taille ?"
"A2","P","Shopping & Money","phrase","do you have this in another color, formal","vous avez ça dans une autre couleur","Vous avez ça dans une autre couleur ?"
"A2","P","Shopping & Money","phrase","I would like to exchange this","je voudrais échanger ça","Je voudrais échanger ça."
"A2","P","Shopping & Money","phrase","can I get a refund, formal","je peux être remboursé","Je peux être remboursé ?"
"A2","P","Shopping & Money","phrase","can I get a refund, feminine","je peux être remboursée","Je peux être remboursée ?"
"A2","P","Shopping & Money","phrase","I keep the receipt","je garde le reçu","Je garde le reçu."
"A2","P","Shopping & Money","phrase","is there a discount","il y a une réduction","Il y a une réduction ?"
"A2","P","Time","phrase","I have been here since","je suis ici depuis","Je suis ici depuis lundi."
"A2","P","Time","phrase","I have lived here for","j'habite ici depuis","J'habite ici depuis deux ans."
"A2","P","Time","phrase","I have an appointment at","j'ai rendez-vous à","J'ai rendez-vous à trois heures."
"A2","P","Time","phrase","I am available at","je suis disponible à","Je suis disponible à midi."
"A2","P","Time","phrase","I am not available","je ne suis pas disponible","Je ne suis pas disponible."
"A2","P","Time","phrase","see you later","à plus tard","À plus tard."
"A2","P","Time","phrase","see you soon","à bientôt","À bientôt."
"A2","P","Weather & Nature","phrase","the temperature is going down","la température baisse","La température baisse."
"A2","P","Weather & Nature","phrase","the temperature is going up","la température monte","La température monte."
"A2","P","Weather & Nature","phrase","there is a storm","il y a un orage","Il y a un orage."
"A2","P","Weather & Nature","phrase","the weather is changing","le temps change","Le temps change."
"A2","P","Weather & Nature","phrase","I prefer summer","je préfère l'été","Je préfère l'été."
"A2","P","Health & Body","phrase","I have a fever","j'ai de la fièvre","J'ai de la fièvre."
"A2","P","Health & Body","phrase","I have a cold","j'ai un rhume","J'ai un rhume."
"A2","P","Health & Body","phrase","I need medicine","j'ai besoin d'un médicament","J'ai besoin d'un médicament."
"A2","P","Health & Body","phrase","I need to rest","j'ai besoin de me reposer","J'ai besoin de me reposer."
"A2","P","Health & Body","phrase","I have an appointment with the doctor","j'ai rendez-vous chez le médecin","J'ai rendez-vous chez le médecin."
"A2","P","Health & Body","phrase","where is the pharmacy","où est la pharmacie","Où est la pharmacie ?"
"A2","P","Emotions & Opinions","phrase","in my opinion","selon moi","Selon moi, c'est utile."
"A2","P","Emotions & Opinions","phrase","I am not sure","je ne suis pas sûr","Je ne suis pas sûr."
"A2","P","Emotions & Opinions","phrase","I am not sure, feminine","je ne suis pas sûre","Je ne suis pas sûre."
"A2","P","Emotions & Opinions","phrase","that seems difficult","ça semble difficile","Ça semble difficile."
"A2","P","Emotions & Opinions","phrase","that makes me happy","ça me fait plaisir","Ça me fait plaisir."
"A2","P","Emotions & Opinions","phrase","that bothers me","ça me dérange","Ça me dérange."
"A2","P","Emotions & Opinions","phrase","I have a problem","j'ai un problème","J'ai un problème."
"A2","P","Emotions & Opinions","phrase","I found a solution","j'ai trouvé une solution","J'ai trouvé une solution."
"A2","P","Work & Study","phrase","I am looking for a job","je cherche un emploi","Je cherche un emploi."
"A2","P","Work & Study","phrase","I am applying for a job","je postule pour un emploi","Je postule pour un emploi."
"A2","P","Work & Study","phrase","I am doing an internship","je fais un stage","Je fais un stage."
"A2","P","Work & Study","phrase","I have an exam","j'ai un examen","J'ai un examen."
"A2","P","Work & Study","phrase","I passed the exam","j'ai réussi l'examen","J'ai réussi l'examen."
"A2","P","Work & Study","phrase","I failed the exam","j'ai raté l'examen","J'ai raté l'examen."
"A2","P","Work & Study","phrase","I am preparing a meeting","je prépare une réunion","Je prépare une réunion."
"A2","P","Technology","phrase","I forgot my password","j'ai oublié mon mot de passe","J'ai oublié mon mot de passe."
"A2","P","Technology","phrase","I create an account","je crée un compte","Je crée un compte."
"A2","P","Technology","phrase","I cannot connect","je ne peux pas me connecter","Je ne peux pas me connecter."
"A2","P","Technology","phrase","can you send me the link, informal","tu peux m'envoyer le lien","Tu peux m'envoyer le lien ?"
"A2","P","Technology","phrase","can you send me the link, formal","vous pouvez m'envoyer le lien","Vous pouvez m'envoyer le lien ?"
"A2","P","Technology","phrase","I save the file","j'enregistre le fichier","J'enregistre le fichier."
"A2","P","Technology","phrase","I share the document","je partage le document","Je partage le document."
"A2","P","Business Terminology","phrase","I would like to make an appointment","je voudrais prendre rendez-vous","Je voudrais prendre rendez-vous."
"A2","P","Business Terminology","phrase","I have a meeting with","j'ai une réunion avec","J'ai une réunion avec l'équipe."
"A2","P","Business Terminology","phrase","the order is confirmed","la commande est confirmée","La commande est confirmée."
"A2","P","Business Terminology","phrase","the delivery is free","la livraison est gratuite","La livraison est gratuite."
"A2","P","Business Terminology","phrase","please sign here, formal","signez ici, s'il vous plaît","Signez ici, s'il vous plaît."
"A2","P","Business Terminology","phrase","the deadline is Friday","la date limite est vendredi","La date limite est vendredi."
"A2","P","Connectors","phrase","first I","d'abord, je","D'abord, je lis."
"A2","P","Connectors","phrase","then I","ensuite, je","Ensuite, je réponds."
"A2","P","Connectors","phrase","for example","par exemple","Par exemple, je peux venir."
"A2","P","Connectors","phrase","since Monday","depuis lundi","Depuis lundi."
"A2","P","Connectors","phrase","until tomorrow","jusqu'à demain","Jusqu'à demain."
"A2","P","Connectors","phrase","especially when","surtout quand","Surtout quand il pleut."
"A2","P","Connectors","phrase","while I","pendant que je","Pendant que je cuisine."
"A2","P","Connectors","phrase","however I","cependant, je","Cependant, je continue."
"B1","W","Daily Verbs","verb","to manage","gérer","Je gère mon temps mieux maintenant."
"B1","W","Daily Verbs","verb","to improve","améliorer","Je veux améliorer mon français."
"B1","W","Daily Verbs","verb","to increase","augmenter","Les prix augmentent souvent."
"B1","W","Daily Verbs","verb","to decrease","diminuer","La température diminue ce soir."
"B1","W","Daily Verbs","verb","to avoid","éviter","J'évite les rues bruyantes."
"B1","W","Daily Verbs","verb","to allow","permettre","Ce billet permet d'entrer au musée."
"B1","W","Daily Verbs","verb","to prevent","empêcher","La pluie empêche la sortie."
"B1","W","Daily Verbs","verb","to offer","offrir","Elle offre un cadeau à son ami."
"B1","W","Daily Verbs","verb","to accept","accepter","J'accepte votre invitation."
"B1","W","Daily Verbs","verb","to refuse","refuser","Il refuse de répondre."
"B1","W","Daily Verbs","verb","to advise","conseiller","Je te conseille ce restaurant."
"B1","W","Daily Verbs","verb","to suggest","proposer","Elle propose une solution simple."
"B1","W","Daily Verbs","verb","to hope","espérer","J'espère vous revoir bientôt."
"B1","W","Daily Verbs","verb","to notice","remarquer","Je remarque une erreur."
"B1","W","Daily Verbs","verb","to check","vérifier","Je vérifie l'adresse."
"B1","W","Daily Verbs","verb","to depend","dépendre","Cela dépend du temps."
"B1","W","Daily Verbs","verb","to belong","appartenir","Ce vélo appartient à mon frère."
"B1","W","Daily Verbs","verb","to replace","remplacer","Je remplace mon téléphone."
"B1","W","Daily Verbs","verb","to follow","suivre","Je suis les instructions."
"B1","W","Daily Verbs","verb","to reach","atteindre","Nous atteignons notre objectif."
"B1","W","People & Family","noun","childhood","l'enfance","Son enfance était heureuse."
"B1","W","People & Family","noun","friendship","l'amitié","L'amitié est importante pour moi."
"B1","W","People & Family","noun","relative","le parent","J'ai des parents en Belgique."
"B1","W","People & Family","noun","generation","la génération","Chaque génération a ses habitudes."
"B1","W","People & Family","noun","identity","l'identité","Il montre sa carte d'identité."
"B1","W","People & Family","noun","behavior","le comportement","Son comportement est très calme."
"B1","W","People & Family","noun","habit","l'habitude","J'ai l'habitude de marcher."
"B1","W","People & Family","noun","personality","la personnalité","Elle a une personnalité ouverte."
"B1","W","People & Family","noun","conversation","la conversation","La conversation était intéressante."
"B1","W","People & Family","noun","invitation","l'invitation","Merci pour l'invitation."
"B1","W","Work & Study","noun","experience","l'expérience","J'ai trois ans d'expérience."
"B1","W","Work & Study","noun","skill","la compétence","Cette compétence est utile au travail."
"B1","W","Work & Study","noun","application","la candidature","J'envoie ma candidature aujourd'hui."
"B1","W","Work & Study","noun","interview","l'entretien","Mon entretien est demain matin."
"B1","W","Work & Study","noun","position","le poste","Ce poste est intéressant."
"B1","W","Work & Study","noun","task","la tâche","Cette tâche prend du temps."
"B1","W","Work & Study","noun","responsibility","la responsabilité","J'ai beaucoup de responsabilités."
"B1","W","Work & Study","noun","colleague","le collègue","Mon collègue m'aide souvent."
"B1","W","Work & Study","noun","training course","la formation","La formation dure deux semaines."
"B1","W","Work & Study","noun","goal","l'objectif","Mon objectif est clair."
"B1","W","Business Terminology","noun","customer service","le service client","Le service client répond vite."
"B1","W","Business Terminology","noun","agreement","l'accord","Nous avons trouvé un accord."
"B1","W","Business Terminology","noun","condition","la condition","La condition est simple."
"B1","W","Business Terminology","noun","quality","la qualité","La qualité du produit est bonne."
"B1","W","Business Terminology","noun","quantity","la quantité","La quantité est suffisante."
"B1","W","Business Terminology","noun","increase","l'augmentation","L'augmentation des prix continue."
"B1","W","Business Terminology","noun","decrease","la baisse","La baisse des ventes inquiète l'équipe."
"B1","W","Business Terminology","noun","market","le marché","Le marché change rapidement."
"B1","W","Business Terminology","noun","competitor","le concurrent","Ce concurrent propose un bon prix."
"B1","W","Business Terminology","noun","result","le résultat","Le résultat est positif."
"B1","W","Travel & City","noun","accommodation","le logement","Nous cherchons un logement pas cher."
"B1","W","Travel & City","noun","destination","la destination","Cette destination est populaire."
"B1","W","Travel & City","noun","border","la frontière","La frontière est proche."
"B1","W","Travel & City","noun","countryside","la campagne","La campagne est calme."
"B1","W","Travel & City","noun","suburb","la banlieue","Il habite en banlieue."
"B1","W","Travel & City","noun","traffic jam","l'embouteillage","L'embouteillage nous retarde."
"B1","W","Travel & City","noun","driver","le conducteur","Le conducteur est prudent."
"B1","W","Travel & City","noun","passenger","le passager","Le passager attend le train."
"B1","W","Travel & City","noun","entrance","l'entrée","L'entrée du musée est ici."
"B1","W","Travel & City","noun","exit","la sortie","La sortie est à gauche."
"B1","W","Health & Body","noun","health","la santé","La santé est essentielle."
"B1","W","Health & Body","noun","appointment","la consultation","La consultation commence bientôt."
"B1","W","Health & Body","noun","treatment","le traitement","Le traitement dure une semaine."
"B1","W","Health & Body","noun","symptom","le symptôme","Ce symptôme est fréquent."
"B1","W","Health & Body","noun","accident","l'accident","L'accident a eu lieu hier."
"B1","W","Health & Body","noun","emergency","l'urgence","C'est une urgence médicale."
"B1","W","Health & Body","noun","insurance","l'assurance","Mon assurance couvre les soins."
"B1","W","Health & Body","noun","stress","le stress","Le stress me fatigue."
"B1","W","Health & Body","noun","sleep","le sommeil","Le sommeil est important."
"B1","W","Health & Body","verb","to breathe","respirer","Respire doucement."
"B1","W","Emotions & Opinions","noun","doubt","le doute","J'ai un doute."
"B1","W","Emotions & Opinions","noun","decision","la décision","Cette décision est difficile."
"B1","W","Emotions & Opinions","noun","advantage","l'avantage","C'est un grand avantage."
"B1","W","Emotions & Opinions","noun","disadvantage","l'inconvénient","Il y a un inconvénient."
"B1","W","Emotions & Opinions","noun","opportunity","l'occasion","C'est une bonne occasion."
"B1","W","Emotions & Opinions","noun","mistake","l'erreur","J'ai fait une erreur."
"B1","W","Emotions & Opinions","adjective","necessary","nécessaire","C'est nécessaire pour réussir."
"B1","W","Emotions & Opinions","adjective","useful","utile","Cette méthode est utile."
"B1","W","Emotions & Opinions","adjective","serious","sérieux","Le problème est sérieux."
"B1","W","Emotions & Opinions","adjective","pleasant","agréable","La soirée était agréable."
"B1","W","Technology","noun","network","le réseau","Le réseau ne fonctionne pas."
"B1","W","Technology","noun","device","l'appareil","Cet appareil est pratique."
"B1","W","Technology","noun","update","la mise à jour","La mise à jour est terminée."
"B1","W","Technology","noun","data","les données","Les données sont protégées."
"B1","W","Technology","noun","privacy","la confidentialité","La confidentialité est importante."
"B1","W","Technology","verb","to update","mettre à jour","Je mets à jour l'application."
"B1","W","Technology","verb","to install","installer","J'installe un programme."
"B1","W","Technology","verb","to delete","supprimer","Je supprime le fichier."
"B1","W","Technology","verb","to search","rechercher","Je recherche une information."
"B1","W","Technology","adjective","automatic","automatique","La réponse est automatique."
"B1","W","Connectors","connector","although","bien que","Bien que ce soit difficile, je continue."
"B1","W","Connectors","connector","whereas","alors que","Il travaille alors que je me repose."
"B1","W","Connectors","connector","therefore","par conséquent","Il pleut, par conséquent nous restons."
"B1","W","Connectors","connector","nevertheless","néanmoins","C'est cher, néanmoins je l'achète."
"B1","W","Connectors","connector","in addition","de plus","De plus, le service est excellent."
"B1","W","Connectors","connector","on the one hand","d'une part","D'une part, c'est pratique."
"B1","W","Connectors","connector","on the other hand","d'autre part","D'autre part, c'est cher."
"B1","W","Connectors","connector","thanks to","grâce à","Grâce à toi, j'ai réussi."
"B1","W","Connectors","connector","because of","à cause de","Je suis en retard à cause du bus."
"B1","W","Connectors","connector","in order to","afin de","Je travaille afin de réussir."
"B1","P","Daily Verbs","phrase","I have to admit that","je dois admettre que","Je dois admettre que c'est vrai."
"B1","P","Daily Verbs","phrase","I managed to","j'ai réussi à","J'ai réussi à finir."
"B1","P","Daily Verbs","phrase","I am used to","j'ai l'habitude de","J'ai l'habitude de marcher."
"B1","P","Daily Verbs","phrase","I would rather","je préférerais","Je préférerais partir demain."
"B1","P","Daily Verbs","phrase","I am thinking of","je pense à","Je pense à changer de travail."
"B1","P","Daily Verbs","phrase","I am trying to","j'essaie de","J'essaie de parler plus."
"B1","P","Daily Verbs","phrase","I have already","j'ai déjà","J'ai déjà vu ce film."
"B1","P","Daily Verbs","phrase","I have not yet","je n'ai pas encore","Je n'ai pas encore répondu."
"B1","P","Daily Verbs","phrase","I was about to","j'allais","J'allais sortir."
"B1","P","Daily Verbs","phrase","I had to","j'ai dû","J'ai dû annuler."
"B1","P","People & Family","phrase","I get along well with","je m'entends bien avec","Je m'entends bien avec ma sœur."
"B1","P","People & Family","phrase","I have known him for","je le connais depuis","Je le connais depuis longtemps."
"B1","P","People & Family","phrase","I have known her for","je la connais depuis","Je la connais depuis l'école."
"B1","P","People & Family","phrase","we keep in touch","nous restons en contact","Nous restons en contact."
"B1","P","People & Family","phrase","we lost touch","nous avons perdu contact","Nous avons perdu contact."
"B1","P","People & Family","phrase","he looks like","il ressemble à","Il ressemble à son père."
"B1","P","People & Family","phrase","she looks like","elle ressemble à","Elle ressemble à sa mère."
"B1","P","People & Family","phrase","I trust","j'ai confiance en","J'ai confiance en toi."
"B1","P","People & Family","phrase","I do not trust","je n'ai pas confiance en","Je n'ai pas confiance en lui."
"B1","P","People & Family","phrase","we have a lot in common","nous avons beaucoup en commun","Nous avons beaucoup en commun."
"B1","P","Work & Study","phrase","I am responsible for","je suis responsable de","Je suis responsable du projet."
"B1","P","Work & Study","phrase","I have experience in","j'ai de l'expérience en","J'ai de l'expérience en vente."
"B1","P","Work & Study","phrase","I am looking for a position","je cherche un poste","Je cherche un poste intéressant."
"B1","P","Work & Study","phrase","I sent my application","j'ai envoyé ma candidature","J'ai envoyé ma candidature."
"B1","P","Work & Study","phrase","I have a job interview","j'ai un entretien d'embauche","J'ai un entretien d'embauche."
"B1","P","Work & Study","phrase","I work full time","je travaille à temps plein","Je travaille à temps plein."
"B1","P","Work & Study","phrase","I work part time","je travaille à temps partiel","Je travaille à temps partiel."
"B1","P","Work & Study","phrase","I am on leave","je suis en congé","Je suis en congé."
"B1","P","Work & Study","phrase","I need more time","j'ai besoin de plus de temps","J'ai besoin de plus de temps."
"B1","P","Work & Study","phrase","I will do my best","je ferai de mon mieux","Je ferai de mon mieux."
"B1","P","Business Terminology","phrase","could you send me, formal","pourriez-vous m'envoyer","Pourriez-vous m'envoyer le document ?"
"B1","P","Business Terminology","phrase","I am contacting you about","je vous contacte au sujet de","Je vous contacte au sujet du contrat."
"B1","P","Business Terminology","phrase","please find attached","veuillez trouver ci-joint","Veuillez trouver ci-joint la facture."
"B1","P","Business Terminology","phrase","thank you in advance","merci d'avance","Merci d'avance pour votre aide."
"B1","P","Business Terminology","phrase","I remain available","je reste disponible","Je reste disponible pour toute question."
"B1","P","Business Terminology","phrase","we have agreed on","nous sommes d'accord sur","Nous sommes d'accord sur le prix."
"B1","P","Business Terminology","phrase","the deadline is approaching","la date limite approche","La date limite approche."
"B1","P","Business Terminology","phrase","the result is positive","le résultat est positif","Le résultat est positif."
"B1","P","Business Terminology","phrase","sales are increasing","les ventes augmentent","Les ventes augmentent."
"B1","P","Business Terminology","phrase","sales are decreasing","les ventes diminuent","Les ventes diminuent."
"B1","P","Travel & City","phrase","I would like to book a room","je voudrais réserver une chambre","Je voudrais réserver une chambre."
"B1","P","Travel & City","phrase","my train has been delayed","mon train a du retard","Mon train a du retard."
"B1","P","Travel & City","phrase","I missed the train","j'ai raté le train","J'ai raté le train."
"B1","P","Travel & City","phrase","how long does the trip take","combien de temps dure le trajet","Combien de temps dure le trajet ?"
"B1","P","Travel & City","phrase","is breakfast included","le petit déjeuner est inclus","Le petit déjeuner est inclus ?"
"B1","P","Travel & City","phrase","I would like a quiet room","je voudrais une chambre calme","Je voudrais une chambre calme."
"B1","P","Travel & City","phrase","I need to change my reservation","je dois modifier ma réservation","Je dois modifier ma réservation."
"B1","P","Travel & City","phrase","I am here for work","je suis ici pour le travail","Je suis ici pour le travail."
"B1","P","Travel & City","phrase","I am here on holiday","je suis ici en vacances","Je suis ici en vacances."
"B1","P","Travel & City","phrase","I would like some information","je voudrais des renseignements","Je voudrais des renseignements."
"B1","P","Health & Body","phrase","I do not feel well","je ne me sens pas bien","Je ne me sens pas bien."
"B1","P","Health & Body","phrase","I have pain in","j'ai mal à","J'ai mal à l'épaule."
"B1","P","Health & Body","phrase","I have had a fever since","j'ai de la fièvre depuis","J'ai de la fièvre depuis hier."
