"CEFR_level","Word_Phrase_Sentence","topic","grammar_type","english","french","example"
"A1","P","Daily Verbs","phrase","I am going to","je vais","Je vais."
"A1","P","Daily Verbs","phrase","I can","je peux","Je peux."
"A1","P","Daily Verbs","phrase","I must / I have to","je dois","Je dois."
"A1","P","Daily Verbs","phrase","I need to","j'ai besoin de","J'ai besoin de."
"A1","P","Daily Verbs","phrase","I like to","j'aime","J'aime."
"A1","P","Daily Verbs","phrase","I don't like to","je n'aime pas","Je n'aime pas."
"A1","P","Daily Verbs","phrase","I know how to","je sais","Je sais."
"A1","P","Daily Verbs","phrase","I am learning to","j'apprends à","J'apprends à."
"A1","P","Daily Verbs","phrase","you want to","tu veux","Tu veux."
"A1","P","Daily Verbs","phrase","you would like to","tu voudrais","Tu voudrais."
"A1","P","Daily Verbs","phrase","you are going to","tu vas","Tu vas."
"A1","P","Daily Verbs","phrase","you can","tu peux","Tu peux."
"A1","P","Daily Verbs","phrase","you must / you have to","tu dois","Tu dois."
"A1","P","Daily Verbs","phrase","you need to","tu as besoin de","Tu as besoin de."
"A1","P","Daily Verbs","phrase","do you want to","tu veux","Tu veux ?"
"A1","P","Daily Verbs","phrase","can you","tu peux","Tu peux ?"
"A1","P","Daily Verbs","phrase","you like to","tu aimes","Tu aimes."
"A1","P","Daily Verbs","phrase","you don't like to","tu n'aimes pas","Tu n'aimes pas."
"A1","P","Daily Verbs","phrase","would you like to","vous voudriez","Vous voudriez ?"
"A1","P","Daily Verbs","phrase","you can formal","vous pouvez","Vous pouvez."
"A1","P","Daily Verbs","phrase","you must formal","vous devez","Vous devez."
"A1","P","Daily Verbs","phrase","do you want formal","vous voulez","Vous voulez ?"
"A1","P","Daily Verbs","phrase","can you formal","vous pouvez","Vous pouvez ?"
"A1","P","People & Family","phrase","I am called","je m'appelle","Je m'appelle."
"A1","P","People & Family","phrase","my name is","mon nom est","Mon nom est."
"A1","P","People & Family","phrase","what is your name informal","comment tu t'appelles","Comment tu t'appelles ?"
"A1","P","People & Family","phrase","what is your name formal","comment vous vous appelez","Comment vous vous appelez ?"
"A1","P","People & Family","phrase","I am years old","j'ai ... ans","J'ai vingt ans."
"A1","P","People & Family","phrase","how old are you informal","tu as quel âge","Tu as quel âge ?"
"A1","P","People & Family","phrase","how old are you formal","vous avez quel âge","Vous avez quel âge ?"
"A1","P","People & Family","phrase","I live in","j'habite à","J'habite à Paris."
"A1","P","People & Family","phrase","I come from","je viens de","Je viens de France."
"A1","P","People & Family","phrase","I am from","je suis de","Je suis de Lyon."
"A1","P","People & Family","phrase","this is my","c'est mon","C'est mon frère."
"A1","P","People & Family","phrase","this is my feminine","c'est ma","C'est ma sœur."
"A1","P","People & Family","phrase","these are my","ce sont mes","Ce sont mes parents."
"A1","P","People & Family","phrase","I have a","j'ai un","J'ai un frère."
"A1","P","People & Family","phrase","I have a feminine","j'ai une","J'ai une sœur."
"A1","P","Food & Drink","phrase","I would like","je voudrais","Je voudrais."
"A1","P","Food & Drink","phrase","I would like a masculine","je voudrais un","Je voudrais un café."
"A1","P","Food & Drink","phrase","I would like a feminine","je voudrais une","Je voudrais une salade."
"A1","P","Food & Drink","phrase","I would like some","je voudrais du","Je voudrais du pain."
"A1","P","Food & Drink","phrase","I would like some feminine","je voudrais de la","Je voudrais de la soupe."
"A1","P","Food & Drink","phrase","I would like some plural","je voudrais des","Je voudrais des pâtes."
"A1","P","Food & Drink","phrase","I am hungry","j'ai faim","J'ai faim."
"A1","P","Food & Drink","phrase","I am thirsty","j'ai soif","J'ai soif."
"A1","P","Food & Drink","phrase","I eat","je mange","Je mange."
"A1","P","Food & Drink","phrase","I drink","je bois","Je bois."
"A1","P","Food & Drink","phrase","for me","pour moi","Pour moi."
"A1","P","Food & Drink","phrase","the bill please","l'addition s'il vous plaît","L'addition, s'il vous plaît."
"A1","P","Shopping & Money","phrase","how much is it","ça coûte combien","Ça coûte combien ?"
"A1","P","Shopping & Money","phrase","how much does this cost","combien ça coûte","Combien ça coûte ?"
"A1","P","Shopping & Money","phrase","I am looking for","je cherche","Je cherche."
"A1","P","Shopping & Money","phrase","I would like to buy","je voudrais acheter","Je voudrais acheter."
"A1","P","Shopping & Money","phrase","can I try informal","je peux essayer","Je peux essayer ?"
"A1","P","Shopping & Money","phrase","can I try formal","puis-je essayer","Puis-je essayer ?"
"A1","P","Shopping & Money","phrase","it is too expensive","c'est trop cher","C'est trop cher."
"A1","P","Shopping & Money","phrase","it is cheap","ce n'est pas cher","Ce n'est pas cher."
"A1","P","Shopping & Money","phrase","I pay by card","je paie par carte","Je paie par carte."
"A1","P","Shopping & Money","phrase","I pay in cash","je paie en espèces","Je paie en espèces."
"A1","P","Travel & City","phrase","I am going to","je vais à","Je vais à Paris."
"A1","P","Travel & City","phrase","I take the","je prends le","Je prends le train."
"A1","P","Travel & City","phrase","I am looking for the","je cherche le","Je cherche le métro."
"A1","P","Travel & City","phrase","where is","où est","Où est la gare ?"
"A1","P","Travel & City","phrase","where are","où sont","Où sont les toilettes ?"
"A1","P","Travel & City","phrase","is it far","c'est loin","C'est loin ?"
"A1","P","Travel & City","phrase","it is near","c'est près","C'est près."
"A1","P","Travel & City","phrase","to the right","à droite","À droite."
"A1","P","Travel & City","phrase","to the left","à gauche","À gauche."
"A1","P","Travel & City","phrase","straight ahead","tout droit","Tout droit."
"A1","P","Time","phrase","what time is it","quelle heure est-il","Quelle heure est-il ?"
"A1","P","Time","phrase","at what time","à quelle heure","À quelle heure ?"
"A1","P","Time","phrase","it is one o'clock","il est une heure","Il est une heure."
"A1","P","Time","phrase","it is two o'clock","il est deux heures","Il est deux heures."
"A1","P","Time","phrase","in the morning","le matin","Le matin."
"A1","P","Time","phrase","in the afternoon","l'après-midi","L'après-midi."
"A1","P","Time","phrase","in the evening","le soir","Le soir."
"A1","P","Time","phrase","today I","aujourd'hui, je","Aujourd'hui, je travaille."
"A1","P","Time","phrase","tomorrow I","demain, je","Demain, je pars."
"A1","P","Time","phrase","every day","tous les jours","Tous les jours."
"A1","P","Emotions & Opinions","phrase","I think that","je pense que","Je pense que c'est bien."
"A1","P","Emotions & Opinions","phrase","I believe that","je crois que","Je crois que oui."
"A1","P","Emotions & Opinions","phrase","I prefer","je préfère","Je préfère le thé."
"A1","P","Emotions & Opinions","phrase","I am happy","je suis content","Je suis content."
"A1","P","Emotions & Opinions","phrase","I am sad","je suis triste","Je suis triste."
"A1","P","Emotions & Opinions","phrase","I am tired","je suis fatigué","Je suis fatigué."
"A1","P","Emotions & Opinions","phrase","that is good","c'est bien","C'est bien."
"A1","P","Emotions & Opinions","phrase","that is not bad","ce n'est pas mal","Ce n'est pas mal."
"A1","P","Emotions & Opinions","phrase","I agree","je suis d'accord","Je suis d'accord."
"A1","P","Emotions & Opinions","phrase","I don't agree","je ne suis pas d'accord","Je ne suis pas d'accord."
"A1","P","Health & Body","phrase","I feel well","je me sens bien","Je me sens bien."
"A1","P","Health & Body","phrase","I feel bad","je me sens mal","Je me sens mal."
"A1","P","Health & Body","phrase","I am sick","je suis malade","Je suis malade."
"A1","P","Health & Body","phrase","I have a headache","j'ai mal à la tête","J'ai mal à la tête."
"A1","P","Health & Body","phrase","I have a stomach ache","j'ai mal au ventre","J'ai mal au ventre."
"A1","P","Health & Body","phrase","I need a doctor","j'ai besoin d'un médecin","J'ai besoin d'un médecin."
"A1","P","Home","phrase","I am at home","je suis à la maison","Je suis à la maison."
"A1","P","Home","phrase","come in informal","entre","Entre."
"A1","P","Home","phrase","come in formal","entrez","Entrez."
"A1","P","Home","phrase","make yourself at home formal","faites comme chez vous","Faites comme chez vous."
"A1","P","Weather & Nature","phrase","the weather is nice","il fait beau","Il fait beau."
"A1","P","Weather & Nature","phrase","it is hot","il fait chaud","Il fait chaud."
"A1","P","Weather & Nature","phrase","it is cold","il fait froid","Il fait froid."
"A1","P","Weather & Nature","phrase","it is raining","il pleut","Il pleut."
"A1","P","Work & Study","phrase","I work at","je travaille à","Je travaille à Paris."
"A1","P","Work & Study","phrase","I study","j'étudie","J'étudie le français."
"A1","P","Work & Study","phrase","I have a question","j'ai une question","J'ai une question."
"A1","P","Work & Study","phrase","I don't understand","je ne comprends pas","Je ne comprends pas."
"A1","P","Technology","phrase","I send a message","j'envoie un message","J'envoie un message."
"A1","P","Technology","phrase","I call you informal","je t'appelle","Je t'appelle."
"A1","P","Technology","phrase","I call you formal","je vous appelle","Je vous appelle."
"A1","P","Technology","phrase","it works","ça marche","Ça marche."
"A1","P","Connectors","phrase","because I","parce que je","Parce que je travaille."
"A1","P","Connectors","phrase","but I","mais je","Mais je suis fatigué."
"A1","P","Connectors","phrase","with you informal","avec toi","Avec toi."
"A1","P","Connectors","phrase","with you formal","avec vous","Avec vous."
"A1","P","Business Terminology","phrase","I have a meeting","j'ai une réunion","J'ai une réunion."
"A1","P","Business Terminology","phrase","I have an appointment","j'ai un rendez-vous","J'ai un rendez-vous."
"A2","W","People & Family","noun","neighbor","le voisin","Mon voisin est très gentil."
"A2","W","People & Family","noun","couple","le couple","Ce couple habite près d'ici."
"A2","W","People & Family","noun","adult","l'adulte","Un adulte accompagne les enfants."
"A2","W","People & Family","noun","teenager","l'adolescent","L'adolescent va au collège."
"A2","W","People & Family","noun","baby","le bébé","Le bébé dort dans la chambre."
"A2","W","People & Family","noun","birth","la naissance","La naissance est en juillet."
"A2","W","People & Family","noun","address","l'adresse","Quelle est votre adresse ?"
"A2","W","People & Family","noun","nationality","la nationalité","Quelle est ta nationalité ?"
"A2","W","People & Family","noun","relationship","la relation","J'ai une bonne relation avec ma sœur."
"A2","W","People & Family","noun","wedding","le mariage","Le mariage est samedi."
"A2","W","Daily Verbs","verb","to choose","choisir","Je choisis une robe bleue."
"A2","W","Daily Verbs","verb","to begin","commencer","Le cours commence à neuf heures."
"A2","W","Daily Verbs","verb","to finish","finir","Je finis mon travail à cinq heures."
"A2","W","Daily Verbs","verb","to continue","continuer","Nous continuons la leçon."
"A2","W","Daily Verbs","verb","to remember","se souvenir","Je me souviens de cette ville."
"A2","W","Daily Verbs","verb","to forget","oublier","J'oublie souvent mes clés."
"A2","W","Daily Verbs","verb","to explain","expliquer","Le professeur explique la phrase."
"A2","W","Daily Verbs","verb","to show","montrer","Je montre la photo à mon ami."
"A2","W","Daily Verbs","verb","to help","aider","Elle aide son frère."
"A2","W","Daily Verbs","verb","to invite","inviter","Nous invitons nos voisins."
"A2","W","Daily Verbs","verb","to answer","répondre","Je réponds à la question."
"A2","W","Daily Verbs","verb","to receive","recevoir","Je reçois un message."
"A2","W","Daily Verbs","verb","to send","envoyer","Elle envoie une lettre."
"A2","W","Daily Verbs","verb","to bring","apporter","J'apporte une bouteille d'eau."
"A2","W","Daily Verbs","verb","to carry","porter","Il porte un sac lourd."
"A2","W","Daily Verbs","verb","to keep","garder","Je garde les enfants ce soir."
"A2","W","Daily Verbs","verb","to lose","perdre","Je perds mon ticket."
"A2","W","Daily Verbs","verb","to win","gagner","Notre équipe gagne le match."
"A2","W","Daily Verbs","verb","to move","bouger","Ne bouge pas."
"A2","W","Daily Verbs","verb","to return","retourner","Je retourne à la maison."
"A2","W","Adjectives","adjective","same","même","Nous avons le même professeur."
"A2","W","Adjectives","adjective","different","différent","C'est un quartier différent."
"A2","W","Adjectives","adjective","full","plein","Le bus est plein."
"A2","W","Adjectives","adjective","empty","vide","La salle est vide."
"A2","W","Adjectives","adjective","clean","propre","La cuisine est propre."
"A2","W","Adjectives","adjective","dirty","sale","Ses chaussures sont sales."
"A2","W","Adjectives","adjective","quiet","calme","La rue est calme."
"A2","W","Adjectives","adjective","noisy","bruyant","Ce restaurant est bruyant."
"A2","W","Adjectives","adjective","comfortable","confortable","Le canapé est confortable."
"A2","W","Adjectives","adjective","useful","utile","Cette application est utile."
"A2","W","Adjectives","adjective","dangerous","dangereux","Cette route est dangereuse."
"A2","W","Adjectives","adjective","free","gratuit","Le musée est gratuit aujourd'hui."
"A2","W","Adjectives","adjective","available","disponible","La chambre est disponible."
"A2","W","Adjectives","adjective","closed","fermé","Le magasin est fermé."
"A2","W","Adjectives","adjective","open","ouvert","La banque est ouverte."
"A2","W","Food & Drink","noun","meal","le repas","Le repas est délicieux."
"A2","W","Food & Drink","noun","starter","l'entrée","Je prends une entrée."
"A2","W","Food & Drink","noun","main course","le plat","Le plat arrive bientôt."
"A2","W","Food & Drink","noun","dessert","le dessert","Le dessert est au chocolat."
"A2","W","Food & Drink","noun","menu","le menu","Je regarde le menu."
"A2","W","Food & Drink","noun","waiter","le serveur","Le serveur apporte l'eau."
"A2","W","Food & Drink","noun","waitress","la serveuse","La serveuse est très polie."
"A2","W","Food & Drink","noun","bottle","la bouteille","Nous commandons une bouteille d'eau."
"A2","W","Food & Drink","noun","glass","le verre","Le verre est vide."
"A2","W","Food & Drink","noun","plate","l'assiette","L'assiette est chaude."
"A2","W","Food & Drink","noun","spoon","la cuillère","Je prends une cuillère."
"A2","W","Food & Drink","noun","fork","la fourchette","La fourchette est sur la table."
"A2","W","Food & Drink","noun","knife","le couteau","Le couteau est propre."
"A2","W","Food & Drink","noun","vegetable","le légume","Ce légume est frais."
"A2","W","Food & Drink","noun","fruit","le fruit","Je mange un fruit."
"A2","W","Food & Drink","adjective","sweet","sucré","Ce dessert est trop sucré."
"A2","W","Food & Drink","adjective","salty","salé","La soupe est salée."
"A2","W","Food & Drink","adjective","fresh","frais","Le poisson est frais."
"A2","W","Home","noun","building","l'immeuble","L'immeuble a six étages."
"A2","W","Home","noun","floor in building","l'étage","J'habite au deuxième étage."
"A2","W","Home","noun","stairs","l'escalier","L'escalier est à gauche."
"A2","W","Home","noun","elevator","l'ascenseur","L'ascenseur ne marche pas."
"A2","W","Home","noun","rent","le loyer","Le loyer est cher."
"A2","W","Home","noun","neighboring area","le quartier","Le quartier est agréable."
"A2","W","Home","noun","furniture","les meubles","Les meubles sont modernes."
"A2","W","Home","noun","sofa","le canapé","Le canapé est confortable."
"A2","W","Home","noun","fridge","le réfrigérateur","Le réfrigérateur est dans la cuisine."
"A2","W","Home","noun","washing machine","la machine à laver","La machine à laver est neuve."
"A2","W","Home","verb","to move house","déménager","Nous déménageons en juin."
"A2","W","Home","verb","to rent","louer","Je loue un studio."
"A2","W","Travel & City","noun","journey","le trajet","Le trajet dure vingt minutes."
"A2","W","Travel & City","noun","trip","le voyage","Le voyage est long."
"A2","W","Travel & City","noun","departure","le départ","Le départ est à dix heures."
"A2","W","Travel & City","noun","arrival","l'arrivée","L'arrivée est prévue à midi."
"A2","W","Travel & City","noun","delay","le retard","Le train a du retard."
"A2","W","Travel & City","noun","platform","le quai","Le train part du quai trois."
"A2","W","Travel & City","noun","suitcase","la valise","Ma valise est lourde."
"A2","W","Travel & City","noun","passport","le passeport","J'ai mon passeport."
"A2","W","Travel & City","noun","reservation","la réservation","La réservation est confirmée."
"A2","W","Travel & City","noun","traffic","la circulation","La circulation est difficile."
"A2","W","Travel & City","verb","to reserve","réserver","Je réserve une chambre."
"A2","W","Travel & City","verb","to cross","traverser","Nous traversons la rue."
"A2","W","Travel & City","verb","to turn","tourner","Tournez à droite."
"A2","W","Travel & City","verb","to visit","visiter","Je visite un musée."
"A2","W","Shopping & Money","noun","sale","les soldes","Les soldes commencent demain."
"A2","W","Shopping & Money","noun","discount","la réduction","Il y a une réduction de dix pour cent."
"A2","W","Shopping & Money","noun","receipt","le reçu","Gardez le reçu."
"A2","W","Shopping & Money","noun","cash register","la caisse","La caisse est au fond."
"A2","W","Shopping & Money","noun","customer","le client","Le client demande le prix."
"A2","W","Shopping & Money","noun","seller","le vendeur","Le vendeur est disponible."
"A2","W","Shopping & Money","noun","wallet","le portefeuille","Mon portefeuille est dans mon sac."
"A2","W","Shopping & Money","noun","gift","le cadeau","J'achète un cadeau."
"A2","W","Shopping & Money","noun","jacket","la veste","Cette veste est élégante."
"A2","W","Shopping & Money","noun","trousers","le pantalon","Le pantalon est trop grand."
"A2","W","Shopping & Money","verb","to exchange","échanger","Je voudrais échanger cette chemise."
"A2","W","Shopping & Money","verb","to refund","rembourser","Le magasin rembourse le client."
"A2","W","Time","noun","date","la date","Quelle est la date aujourd'hui ?"
"A2","W","Time","noun","calendar","le calendrier","Le calendrier est sur le mur."
"A2","W","Time","noun","appointment","le rendez-vous","Le rendez-vous est confirmé."
"A2","W","Time","noun","schedule","l'horaire","L'horaire du train change."
"A2","W","Time","noun","duration","la durée","La durée du film est courte."
"A2","W","Time","noun","moment","le moment","Ce n'est pas le bon moment."
"A2","W","Time","adverb","already","déjà","J'ai déjà mangé."
"A2","W","Time","adverb","not yet","pas encore","Il n'est pas encore arrivé."
"A2","W","Time","adverb","soon","bientôt","Nous partons bientôt."
"A2","W","Time","adverb","later","plus tard","Je t'appelle plus tard."
"A2","W","Time","adverb","recently","récemment","J'ai déménagé récemment."
"A2","W","Time","adverb","normally","normalement","Normalement, je travaille le lundi."
"A2","W","Weather & Nature","noun","season","la saison","Ma saison préférée est l'été."
"A2","W","Weather & Nature","noun","spring","le printemps","Au printemps, il fait doux."
"A2","W","Weather & Nature","noun","summer","l'été","L'été est chaud."
"A2","W","Weather & Nature","noun","autumn","l'automne","L'automne est beau."
"A2","W","Weather & Nature","noun","winter","l'hiver","L'hiver est froid."
"A2","W","Weather & Nature","noun","temperature","la température","La température baisse ce soir."
"A2","W","Weather & Nature","noun","degree","le degré","Il fait quinze degrés."
"A2","W","Weather & Nature","noun","storm","l'orage","L'orage arrive."
"A2","W","Weather & Nature","noun","countryside","la campagne","J'aime la campagne."
"A2","W","Weather & Nature","noun","beach","la plage","La plage est propre."
"A2","W","Weather & Nature","adjective","dry","sec","Le temps est sec."
"A2","W","Weather & Nature","adjective","wet","humide","L'air est humide."
"A2","W","Health & Body","noun","appointment with doctor","la consultation","La consultation dure vingt minutes."
"A2","W","Health & Body","noun","pharmacy","la pharmacie","La pharmacie est ouverte."
"A2","W","Health & Body","noun","prescription","l'ordonnance","Le médecin écrit une ordonnance."
"A2","W","Health & Body","noun","fever","la fièvre","J'ai de la fièvre."
"A2","W","Health & Body","noun","cold illness","le rhume","J'ai un rhume."
"A2","W","Health & Body","noun","cough","la toux","Sa toux est forte."
"A2","W","Health & Body","noun","back","le dos","J'ai mal au dos."
"A2","W","Health & Body","noun","heart","le cœur","Son cœur bat vite."
"A2","W","Health & Body","noun","blood","le sang","Le sang est rouge."
"A2","W","Health & Body","verb","to rest","se reposer","Je me repose ce week-end."
"A2","W","Health & Body","verb","to cough","tousser","Il tousse beaucoup."
"A2","W","Health & Body","verb","to heal","guérir","Elle guérit vite."
"A2","W","Emotions & Opinions","noun","feeling","le sentiment","C'est un sentiment agréable."
"A2","W","Emotions & Opinions","noun","reason","la raison","Je ne connais pas la raison."
"A2","W","Emotions & Opinions","noun","choice","le choix","C'est un choix difficile."
"A2","W","Emotions & Opinions","noun","wish","le souhait","Son souhait est simple."
"A2","W","Emotions & Opinions","noun","problem","le problème","Le problème est urgent."
"A2","W","Emotions & Opinions","noun","solution","la solution","La solution est claire."
"A2","W","Emotions & Opinions","adjective","angry","en colère","Il est en colère."
"A2","W","Emotions & Opinions","adjective","worried","inquiet","Elle est inquiète."
"A2","W","Emotions & Opinions","adjective","proud","fier","Je suis fier de toi."
"A2","W","Emotions & Opinions","adjective","ashamed","honteux","Il est honteux."
"A2","W","Emotions & Opinions","verb","to decide","décider","Je décide de partir."
"A2","W","Emotions & Opinions","verb","to seem","sembler","Cela semble facile."
"A2","W","Work & Study","noun","training","la formation","La formation commence lundi."
"A2","W","Work & Study","noun","exam","l'examen","L'examen est demain."
"A2","W","Work & Study","noun","grade","la note","Ma note est bonne."
"A2","W","Work & Study","noun","diploma","le diplôme","Elle prépare un diplôme."
"A2","W","Work & Study","noun","internship","le stage","Il fait un stage en entreprise."
"A2","W","Work & Study","noun","salary","le salaire","Le salaire est correct."
"A2","W","Work & Study","noun","contract","le contrat","Son contrat commence lundi."
"A2","W","Work & Study","noun","meeting","la réunion","La réunion est importante."
"A2","W","Work & Study","verb","to apply","postuler","Je postule pour un emploi."
"A2","W","Work & Study","verb","to succeed","réussir","Elle réussit son examen."
"A2","W","Work & Study","verb","to fail","rater","Je rate le bus."
"A2","W","Work & Study","verb","to prepare","préparer","Nous préparons la réunion."
"A2","W","Technology","noun","password","le mot de passe","J'oublie mon mot de passe."
"A2","W","Technology","noun","account","le compte","Je crée un compte."
"A2","W","Technology","noun","file","le fichier","Le fichier est trop lourd."
"A2","W","Technology","noun","link","le lien","Le lien est dans le message."
"A2","W","Technology","noun","printer","l'imprimante","L'imprimante ne marche pas."
"A2","W","Technology","noun","battery","la batterie","La batterie est faible."
"A2","W","Technology","verb","to connect","se connecter","Je me connecte au site."
"A2","W","Technology","verb","to save","enregistrer","J'enregistre le fichier."
"A2","W","Technology","verb","to print","imprimer","J'imprime le document."
"A2","W","Technology","verb","to share","partager","Elle partage une photo."
"A2","W","Technology","adjective","digital","numérique","C'est un document numérique."
"A2","W","Business Terminology","noun","sale business","la vente","La vente augmente."
"A2","W","Business Terminology","noun","purchase","l'achat","L'achat est confirmé."
"A2","W","Business Terminology","noun","product","le produit","Ce produit est nouveau."
"A2","W","Business Terminology","noun","service","le service","Le service est rapide."
"A2","W","Business Terminology","noun","order","la commande","La commande arrive demain."
"A2","W","Business Terminology","noun","delivery","la livraison","La livraison est gratuite."
"A2","W","Business Terminology","noun","document","le document","Le document est signé."
"A2","W","Business Terminology","noun","signature","la signature","Votre signature est nécessaire."
"A2","W","Business Terminology","noun","budget","le budget","Le budget est limité."
"A2","W","Business Terminology","noun","deadline","la date limite","La date limite est vendredi."
"A2","W","Business Terminology","verb","to sign","signer","Je signe le contrat."
"A2","W","Business Terminology","verb","to deliver","livrer","L'entreprise livre le produit."
"A2","W","Connectors","connector","however","cependant","Il est fatigué, cependant il continue."
"A2","W","Connectors","connector","therefore","alors","Je suis malade, alors je reste chez moi."
"A2","W","Connectors","connector","while","pendant que","Je lis pendant que tu cuisines."
"A2","W","Connectors","connector","since","depuis","J'habite ici depuis deux ans."
"A2","W","Connectors","connector","until","jusqu'à","Je travaille jusqu'à six heures."
"A2","W","Connectors","connector","especially","surtout","J'aime surtout le fromage."
"A2","W","Connectors","connector","for example","par exemple","Par exemple, je peux venir lundi."
"A2","W","Connectors","connector","finally","enfin","Enfin, nous arrivons."
